{
  "$schema": "https://json-schema.org/draft/2020-12/schema",
  "$id": "https://writ.example/schemas/analysis/discrepancy.schema.json",
  "title": "Writ Benchmark Discrepancy",
  "type": "object",
  "additionalProperties": false,
  "required": [
    "schema_version", "id", "benchmark_reference", "commitment_id", "subject_id",
    "published_result", "computed_result", "category", "summary", "blocking",
    "resolution_status"
  ],
  "properties": {
    "schema_version": {"const": "1.0.0"},
    "id": {"type": "string"},
    "benchmark_reference": {"type": "string"},
    "commitment_id": {"type": "string"},
    "subject_id": {"type": "string"},
    "published_result": {"enum": ["-1", "0", "+1", "not_applicable"]},
    "computed_result": {"enum": ["-1", "0", "+1", "not_applicable", "unresolved"]},
    "category": {
      "enum": [
        "missing_evidence", "implicit_interpretation", "rule_gap", "rule_overlap",
        "prose_metric_mismatch", "action_identity_ambiguity", "attribution_ambiguity",
        "temporal_ambiguity", "extraction_error", "published_data_inconsistency",
        "implementation_defect"
      ]
    },
    "summary": {"type": "string"},
    "details": {"type": "string"},
    "blocking": {"type": "boolean"},
    "resolution_status": {"enum": ["open", "under_review", "resolved", "accepted_difference"]},
    "linked_rule_ids": {"type": "array", "items": {"type": "string"}},
    "linked_claim_ids": {"type": "array", "items": {"type": "string"}},
    "review_ids": {"type": "array", "items": {"type": "string"}}
  }
}
